{
  "schema_version": 1,
  "upstream_commit": "c74f6625f2f570c2f68a748c26477e7634f718da",
  "scope": "GFM source metadata only; not claim verification",
  "sources": [
    {
      "id": "SRC-AU-AEMO-2023-001",
      "title": "계통형성형 인버터 자발적 사양",
      "type": "source",
      "source_ids": [
        "SRC-AU-AEMO-2023-001"
      ],
      "published": "2023-05-29",
      "effective": null,
      "last_verified": "2026-09-09",
      "evidence_level": "Unverified",
      "evidence_assignment": "not_assessed",
      "note_path": "content/gfm/02_Sources/Australia/AEMO_2023_Voluntary_Spec.md",
      "note_sha256": "15ac1931c55d28e27a679ffb36b213c76d5d6abc36d20b0af344c2ca3f4f578f",
      "collection_mode": "Manual",
      "publication_policy": "link-only",
      "source_metadata": {
        "id": "SRC-AU-AEMO-2023-001",
        "family_id": "FAM-AEMO-GFM-SPEC",
        "title_original": "Voluntary Specification for Grid-forming Inverters",
        "title_ko": "계통형성형 인버터 자발적 사양",
        "organization": "AEMO",
        "jurisdiction_market": "Australia NEM",
        "document_type": "자발적 기술사양",
        "edition": "1.0",
        "language": "en",
        "publication_date": "2023-05-29",
        "approval_date": null,
        "effective_date": null,
        "facility_cutoff_date": null,
        "official_page_url": "https://www.aemo.com.au/initiatives/major-programs/engineering-roadmap/engineering-roadmap-execution-reports",
        "official_document_url": "https://www.aemo.com.au/-/media/files/initiatives/primary-frequency-response/2023/gfm-voluntary-spec.pdf",
        "relevant_clauses_pages": "§2.1~2.4, pp.7~20",
        "access_status": "공식 전문 공개",
        "document_status": "확정",
        "applicability": "자발적·연구/조달 참고",
        "rights_holder": "Australian Energy Market Operator Limited",
        "license": "AEMO 저작권 허용조건 참조",
        "terms_url": "https://www.aemo.com.au/privacy-and-legal-notices/copyright-permissions",
        "redistribution": "미확인",
        "rights_checked_on": "2026-09-09",
        "publication_mode": "링크·자체 한국어 요약",
        "review_status": "핵심 검토",
        "verified_on": "2026-09-09"
      }
    },
    {
      "id": "SRC-AU-AEMO-2024-004",
      "title": "계통사고 중 Dalrymple GFM BESS 분석 및 모델링",
      "type": "source",
      "source_ids": [
        "SRC-AU-AEMO-2024-004"
      ],
      "published": "2024-12-20",
      "effective": null,
      "last_verified": "2026-09-09",
      "evidence_level": "Unverified",
      "evidence_assignment": "not_assessed",
      "note_path": "content/gfm/02_Sources/Australia/AEMO_2024_Dalrymple.md",
      "note_sha256": "1aa7d7e6c83a0e18b0a7fae4dd5c6ac60f7a7d7ca620f3aa4f94566a5dda7051",
      "collection_mode": "Manual",
      "publication_policy": "link-only",
      "source_metadata": {
        "id": "SRC-AU-AEMO-2024-004",
        "family_id": "FAM-AEMO-GFM-PROJECT",
        "title_original": "Analysis and modelling of a grid-forming battery energy storage system during a system incident",
        "title_ko": "계통사고 중 Dalrymple GFM BESS 분석 및 모델링",
        "organization": "AEMO",
        "jurisdiction_market": "Australia NEM",
        "document_type": "사고분석·모델검증 보고서",
        "edition": "December 2024 publication",
        "language": "en",
        "publication_date": "2024-12-20",
        "official_page_url": "https://www.aemo.com.au/initiatives/major-programs/engineering-roadmap/engineering-roadmap-execution-reports",
        "official_document_url": "https://www.aemo.com.au/-/media/files/initiatives/engineering-framework/2024/analysis_and_modelling_of_dalrymple_bess_performance_december_2023_events.pdf",
        "relevant_clauses_pages": "보고서 전체; 사건 파형·모델 비교",
        "access_status": "공식 전문 공개",
        "document_status": "확정",
        "applicability": "프로젝트 사례·연구/참고",
        "rights_holder": "Australian Energy Market Operator Limited",
        "license": "AEMO 저작권 허용조건 참조",
        "terms_url": "https://www.aemo.com.au/privacy-and-legal-notices/copyright-permissions",
        "redistribution": "미확인",
        "rights_checked_on": "2026-09-09",
        "publication_mode": "링크·자체 한국어 요약",
        "review_status": "서지·핵심 검토",
        "verified_on": "2026-09-09"
      }
    },
    {
      "id": "SRC-AU-AEMO-2024-003",
      "title": "GFM BESS 합성관성 정량화",
      "type": "source",
      "source_ids": [
        "SRC-AU-AEMO-2024-003"
      ],
      "published": "2024-09-16",
      "effective": null,
      "last_verified": "2026-09-09",
      "evidence_level": "Unverified",
      "evidence_assignment": "not_assessed",
      "note_path": "content/gfm/02_Sources/Australia/AEMO_2024_Synthetic_Inertia.md",
      "note_sha256": "a29870d17feb8cfd0f0798f6803d1818c6f4242c580ced6985fe8894db2df208",
      "collection_mode": "Manual",
      "publication_policy": "link-only",
      "source_metadata": {
        "id": "SRC-AU-AEMO-2024-003",
        "family_id": "FAM-AEMO-GFM-INERTIA",
        "title_original": "Quantifying Synthetic Inertia of a Grid-forming Battery Energy Storage System",
        "title_ko": "GFM BESS 합성관성 정량화",
        "organization": "AEMO",
        "jurisdiction_market": "Australia NEM",
        "document_type": "기술노트",
        "edition": "September 2024",
        "language": "en",
        "publication_date": "2024-09-16",
        "official_page_url": "https://www.aemo.com.au/initiatives/major-programs/engineering-roadmap/engineering-roadmap-execution-reports",
        "official_document_url": "https://www.aemo.com.au/-/media/files/initiatives/engineering-framework/2024/quantifying-synthetic-inertia-from-gfm-bess.pdf",
        "relevant_clauses_pages": "Executive summary; §2~3, pp.3~16",
        "access_status": "공식 전문 공개",
        "document_status": "확정",
        "applicability": "연구·참고",
        "rights_holder": "Australian Energy Market Operator Limited",
        "license": "AEMO 저작권 허용조건 참조",
        "terms_url": "https://www.aemo.com.au/privacy-and-legal-notices/copyright-permissions",
        "redistribution": "미확인",
        "rights_checked_on": "2026-09-09",
        "publication_mode": "링크·자체 한국어 요약",
        "review_status": "핵심 검토",
        "verified_on": "2026-09-09"
      }
    },
    {
      "id": "SRC-AU-AEMO-2024-002",
      "title": "GFM 핵심요건 자발적 모의시험 프레임워크",
      "type": "source",
      "source_ids": [
        "SRC-AU-AEMO-2024-002"
      ],
      "published": "2024-01-18",
      "effective": null,
      "last_verified": "2026-09-09",
      "evidence_level": "Unverified",
      "evidence_assignment": "not_assessed",
      "note_path": "content/gfm/02_Sources/Australia/AEMO_2024_Test_Framework.md",
      "note_sha256": "1addc6ec3fdbeb6f00f9cf9f9e6387f8f1de3a0d3f90f521c2996b8cb1667cd7",
      "collection_mode": "Manual",
      "publication_policy": "link-only",
      "source_metadata": {
        "id": "SRC-AU-AEMO-2024-002",
        "family_id": "FAM-AEMO-GFM-SPEC",
        "title_original": "Voluntary Specification for Grid-forming Inverters: Core Requirements Test Framework",
        "title_ko": "GFM 핵심요건 자발적 모의시험 프레임워크",
        "organization": "AEMO",
        "jurisdiction_market": "Australia NEM",
        "document_type": "모의시험 프레임워크",
        "edition": "January 2024",
        "language": "en",
        "publication_date": "2024-01-18",
        "official_page_url": "https://www.aemo.com.au/initiatives/major-programs/engineering-roadmap/engineering-roadmap-execution-reports",
        "official_document_url": "https://www.aemo.com.au/-/media/files/initiatives/engineering-framework/2023/grid-forming-inverters-jan-2024.pdf",
        "relevant_clauses_pages": "§2~3, pp.9~21; Appendix A1~A2",
        "access_status": "공식 전문 공개",
        "document_status": "확정",
        "applicability": "자발적·연구/계약 참고",
        "rights_holder": "Australian Energy Market Operator Limited",
        "license": "AEMO 저작권 허용조건 참조",
        "terms_url": "https://www.aemo.com.au/privacy-and-legal-notices/copyright-permissions",
        "redistribution": "미확인",
        "rights_checked_on": "2026-09-09",
        "publication_mode": "링크·자체 한국어 요약",
        "review_status": "핵심·수치 검토",
        "verified_on": "2026-09-09"
      }
    },
    {
      "id": "SRC-AU-AEMO-2025-005",
      "title": "GFM 기술 접속기준 접근서",
      "type": "source",
      "source_ids": [
        "SRC-AU-AEMO-2025-005"
      ],
      "published": "2025-08-22",
      "effective": null,
      "last_verified": "2026-09-09",
      "evidence_level": "Unverified",
      "evidence_assignment": "not_assessed",
      "note_path": "content/gfm/02_Sources/Australia/AEMO_2025_Access_Approach.md",
      "note_sha256": "1045aed7a825b84e8857027886af4f215b3426df478b5db2c696cefbe1a0f4a2",
      "collection_mode": "Manual",
      "publication_policy": "link-only",
      "source_metadata": {
        "id": "SRC-AU-AEMO-2025-005",
        "family_id": "FAM-AEMO-GFM-ACCESS",
        "title_original": "Grid-forming Technology Access Standards Approach Paper",
        "title_ko": "GFM 기술 접속기준 접근서",
        "organization": "AEMO",
        "jurisdiction_market": "Australia NEM",
        "document_type": "협의 접근서",
        "edition": "August 2025",
        "language": "en",
        "publication_date": "2025-08-22",
        "effective_date": null,
        "official_page_url": "https://www.aemo.com.au/consultations/current-and-closed-consultations/grid-forming-technology-access-standards-technical-requirements-review",
        "official_document_url": "https://www.aemo.com.au/-/media/files/stakeholder_consultation/consultations/nem-consultations/2025/grid-forming-technology/grid-forming-technology-access-standards-approach-paper.pdf",
        "relevant_clauses_pages": "§2~3; Appendices C~D",
        "access_status": "공식 전문 공개",
        "document_status": "초안·협의",
        "applicability": "향후 시장·접속규칙 제안",
        "rights_holder": "Australian Energy Market Operator Limited",
        "license": "AEMO 저작권 허용조건 참조",
        "terms_url": "https://www.aemo.com.au/privacy-and-legal-notices/copyright-permissions",
        "redistribution": "미확인",